	act	scene	char_from	text	all	barnardo	both	captain	danes	first ambassador	first clown	first player	first sailor	fortinbras	francisco	gentleman	ghost	guildenstern	hamlet	horatio	king	laertes	lord	lords	lucianus	marcellus	messenger	ophelia	osric	player king	player queen	polonius	priest	prologue	queen	reynaldo	rosencrantz	second clown	servant	voltemand
447	3	1	king	love his affection do not that way tend nor what he spake though it lack d form a little be not like madness there something in his soul o er which his melancholy sit on brood and i do doubt the hatch and the disclose will be some danger which for to prevent i have in quick determination thus set it down he shall with speed to england for the demand of our neglected tribute haply the sea and country different with variable object shall expel this something settle matter in his heart whereon his brain still beat put he thus from fashion of himself what think you on t	0	0	0	0	0	0	0	0	0	0	0	0	0	0	0	0	0	0	0	0	0	0	0	1	0	0	0	0	0	0	0	0	0	0	0	0
448	3	1	polonius	it shall do well but yet do i believe the origin and commencement of his grief sprung from neglect love how now ophelia you need not tell we what lord hamlet say we hear it all my lord do as you please but if you hold it fit after the play let his queen mother all alone entreat he to show his grief let she be round with he and i ll be plac d so please you in the ear of all their conference if she find he not to england send he or confine he where your wisdom well shall think	0	0	0	0	0	0	0	0	0	0	0	0	0	0	0	0	1	0	0	0	0	0	0	0	0	0	0	0	0	0	0	0	0	0	0	0
449	3	1	king	it shall be so madness in great one must not unwatch d go	0	0	0	0	0	0	0	0	0	0	0	0	0	0	0	0	0	0	0	0	0	0	0	0	0	0	0	1	0	0	0	0	0	0	0	0
450	3	2	hamlet	speak the speech i pray you as i pronounce it to you trippingly on the tongue but if you mouth it as many of your player do i have as lief the town crier speak my line nor do not see the air too much with your hand thus but use all gently for in the very torrent tempest and as i may say whirlwind of passion you must acquire and beget a temperance that may give it smoothness o it offend i to the soul to hear a robustious periwig pat fellow tear a passion to tatter to very rag to split the ear of the groundling who for the most part be capable of nothing but inexplicable dumb show and noise i would have such a fellow whip for o erdoe termagant it out herods herod pray you avoid it	0	0	0	0	0	0	0	1	0	0	0	0	0	0	0	0	0	0	0	0	0	0	0	0	0	0	0	0	0	0	0	0	0	0	0	0
451	3	2	first player	i warrant your honour	0	0	0	0	0	0	0	0	0	0	0	0	0	0	1	0	0	0	0	0	0	0	0	0	0	0	0	0	0	0	0	0	0	0	0	0
452	3	2	hamlet	be not too tame neither but let your own discretion be your tutor suit the action to the word the word to the action with this special observance that you o erstep not the modesty of nature for anything so overdone be from the purpose of playing whose end both at the first and now be and be to hold as twere the mirror up to nature to show virtue her own feature scorn her own image and the very age and body of the time his form and pressure now this overdone or come tardy off though it make the unskilful laugh can not but make the judicious grieve the censure of the which one must in your allowance o erweigh a whole theatre of other o there be player that i have see play and hear other praise and that highly not to speak it profanely that neither have the accent of christians nor the gait of christian pagan nor man have so strut and bellow that i have think some of nature s journeyman have make man and not make they well they imitate humanity so abominably	0	0	0	0	0	0	0	1	0	0	0	0	0	0	0	0	0	0	0	0	0	0	0	0	0	0	0	0	0	0	0	0	0	0	0	0
453	3	2	first player	i hope we have reform d that indifferently with we sir	0	0	0	0	0	0	0	0	0	0	0	0	0	0	1	0	0	0	0	0	0	0	0	0	0	0	0	0	0	0	0	0	0	0	0	0
454	3	2	hamlet	o reform it altogether and let those that play your clown speak no more than be set down for they for there be of they that will themselves laugh to set on some quantity of barren spectator to laugh too though in the meantime some necessary question of the play be then to be consider that villanous and show a most pitiful ambition in the fool that use it go make you ready enter polonius rosencrantz and guildenstern how now my lord will the king hear this piece of work	0	0	0	0	0	0	0	1	0	0	0	0	0	0	0	0	0	0	0	0	0	0	0	0	0	0	0	0	0	0	0	0	0	0	0	0
455	3	2	polonius	and the queen too and that presently	0	0	0	0	0	0	0	0	0	0	0	0	0	0	1	0	0	0	0	0	0	0	0	0	0	0	0	0	0	0	0	0	0	0	0	0
456	3	2	hamlet	bid the player make haste will you two help to hasten they rosencrantz and	0	0	0	0	0	0	0	0	0	0	0	0	0	0	0	0	0	0	0	0	0	0	0	0	0	0	0	1	0	0	0	0	0	0	0	0
457	3	2	guildenstern	we will my lord	0	0	0	0	0	0	0	0	0	0	0	0	0	0	1	0	0	0	0	0	0	0	0	0	0	0	0	0	0	0	0	0	0	0	0	0
458	3	2	hamlet	what ho horatio enter horatio	0	0	0	0	0	0	0	0	0	0	0	0	0	1	0	0	0	0	0	0	0	0	0	0	0	0	0	0	0	0	0	0	0	0	0	0
459	3	2	horatio	here sweet lord at your service	0	0	0	0	0	0	0	0	0	0	0	0	0	0	1	0	0	0	0	0	0	0	0	0	0	0	0	0	0	0	0	0	0	0	0	0
460	3	2	hamlet	horatio thou art e en as just a man as e er my conversation cop d withal	0	0	0	0	0	0	0	0	0	0	0	0	0	0	0	1	0	0	0	0	0	0	0	0	0	0	0	0	0	0	0	0	0	0	0	0
461	3	2	horatio	o my dear lord	0	0	0	0	0	0	0	0	0	0	0	0	0	0	1	0	0	0	0	0	0	0	0	0	0	0	0	0	0	0	0	0	0	0	0	0
462	3	2	hamlet	nay do not think i flatter for what advancement may i hope from thee that no revenue hast but thy good spirit to feed and clothe thee why should the poor be flatter d no let the candy tongue lick absurd pomp and crook the pregnant hinge of the knee where thrift may follow fawn dost thou hear since my dear soul be mistress of her choice and could of man distinguish her election hath seal d thee for herself for thou hast be as one in suffer all that suffer nothing a man that fortune s buffet and reward hast ta en with equal thank and bles d be those whose blood and judgment be so well co mingle that they be not a pipe for fortune s finger to sound what stop she please give i that man that be not passion s slave and i will wear he in my heart s core ay in my heart of heart as i do thee something too much of this there be a play tonight before the king one scene of it come near the circumstance which i have tell thee of my father s death i prythee when thou see st that act a foot even with the very comment of thy soul observe mine uncle if his occult guilt do not itself unkennel in one speech it be a damned ghost that we have see and my imagination be as foul as vulcan s stithy give he heedful note for i mine eye will rivet to his face and after we will both our judgment join in censure of his seeming	0	0	0	0	0	0	0	0	0	0	0	0	0	0	0	1	0	0	0	0	0	0	0	0	0	0	0	0	0	0	0	0	0	0	0	0
463	3	2	horatio	well my lord if he steal aught the whilst this play be play and scape detect i will pay the theft	0	0	0	0	0	0	0	0	0	0	0	0	0	0	1	0	0	0	0	0	0	0	0	0	0	0	0	0	0	0	0	0	0	0	0	0
464	3	2	hamlet	they be come to the play i must be idle get you a place danish march a flourish enter king queen polonius ophelia rosencrantz guildenstern and other	0	0	0	0	0	0	0	0	0	0	0	0	0	0	0	1	0	0	0	0	0	0	0	0	0	0	0	0	0	0	0	0	0	0	0	0
465	3	2	king	how fare our cousin hamlet	0	0	0	0	0	0	0	0	0	0	0	0	0	0	1	0	0	0	0	0	0	0	0	0	0	0	0	0	0	0	0	0	0	0	0	0
466	3	2	hamlet	excellent i faith of the chameleon s dish i eat the air promise cram you can not feed capon so	0	0	0	0	0	0	0	0	0	0	0	0	0	0	0	0	1	0	0	0	0	0	0	0	0	0	0	0	0	0	0	0	0	0	0	0
467	3	2	king	i have nothing with this answer hamlet these word be not mine	0	0	0	0	0	0	0	0	0	0	0	0	0	0	1	0	0	0	0	0	0	0	0	0	0	0	0	0	0	0	0	0	0	0	0	0
468	3	2	hamlet	no nor mine now my lord you play d once i th university you say	0	0	0	0	0	0	0	0	0	0	0	0	0	0	0	0	1	0	0	0	0	0	0	0	0	0	0	0	0	0	0	0	0	0	0	0
469	3	2	polonius	that do i my lord and be account a good actor	0	0	0	0	0	0	0	0	0	0	0	0	0	0	1	0	0	0	0	0	0	0	0	0	0	0	0	0	0	0	0	0	0	0	0	0
470	3	2	hamlet	what do you enact	0	0	0	0	0	0	0	0	0	0	0	0	0	0	0	0	0	0	0	0	0	0	0	0	0	0	0	1	0	0	0	0	0	0	0	0
471	3	2	polonius	i do enact julius caesar i be kill d i th capitol brutus kill i	0	0	0	0	0	0	0	0	0	0	0	0	0	0	1	0	0	0	0	0	0	0	0	0	0	0	0	0	0	0	0	0	0	0	0	0
472	3	2	hamlet	it be a brute part of he to kill so capital a calf there be the player ready	0	0	0	0	0	0	0	0	0	0	0	0	0	0	0	0	0	0	0	0	0	0	0	0	0	0	0	1	0	0	0	0	0	0	0	0
473	3	2	rosencrantz	ay my lord they stay upon your patience	0	0	0	0	0	0	0	0	0	0	0	0	0	0	1	0	0	0	0	0	0	0	0	0	0	0	0	0	0	0	0	0	0	0	0	0
474	3	2	queen	come hither my dear hamlet sit by i	0	0	0	0	0	0	0	0	0	0	0	0	0	0	0	0	0	0	0	0	0	0	0	0	0	0	0	0	0	0	0	0	1	0	0	0
475	3	2	hamlet	no good mother here metal more attractive	0	0	0	0	0	0	0	0	0	0	0	0	0	0	0	0	0	0	0	0	0	0	0	0	0	0	0	0	0	0	1	0	0	0	0	0
476	3	2	polonius	o ho do you mark that	0	0	0	0	0	0	0	0	0	0	0	0	0	0	1	0	0	0	0	0	0	0	0	0	0	0	0	0	0	0	0	0	0	0	0	0
477	3	2	hamlet	lady shall i lie in your lap	0	0	0	0	0	0	0	0	0	0	0	0	0	0	0	0	0	0	0	0	0	0	0	0	0	0	0	1	0	0	0	0	0	0	0	0
478	3	2	ophelia	no my lord	0	0	0	0	0	0	0	0	0	0	0	0	0	0	1	0	0	0	0	0	0	0	0	0	0	0	0	0	0	0	0	0	0	0	0	0
479	3	2	hamlet	i mean my head upon your lap	0	0	0	0	0	0	0	0	0	0	0	0	0	0	0	0	0	0	0	0	0	0	0	1	0	0	0	0	0	0	0	0	0	0	0	0
480	3	2	ophelia	ay my lord	0	0	0	0	0	0	0	0	0	0	0	0	0	0	1	0	0	0	0	0	0	0	0	0	0	0	0	0	0	0	0	0	0	0	0	0
481	3	2	hamlet	do you think i mean country matter	0	0	0	0	0	0	0	0	0	0	0	0	0	0	0	0	0	0	0	0	0	0	0	1	0	0	0	0	0	0	0	0	0	0	0	0
482	3	2	ophelia	i think nothing my lord	0	0	0	0	0	0	0	0	0	0	0	0	0	0	1	0	0	0	0	0	0	0	0	0	0	0	0	0	0	0	0	0	0	0	0	0
483	3	2	hamlet	that a fair thought to lie between maid leg	0	0	0	0	0	0	0	0	0	0	0	0	0	0	0	0	0	0	0	0	0	0	0	1	0	0	0	0	0	0	0	0	0	0	0	0
484	3	2	ophelia	what be my lord	0	0	0	0	0	0	0	0	0	0	0	0	0	0	1	0	0	0	0	0	0	0	0	0	0	0	0	0	0	0	0	0	0	0	0	0
485	3	2	hamlet	nothing	0	0	0	0	0	0	0	0	0	0	0	0	0	0	0	0	0	0	0	0	0	0	0	1	0	0	0	0	0	0	0	0	0	0	0	0
486	3	2	ophelia	you be merry my lord	0	0	0	0	0	0	0	0	0	0	0	0	0	0	1	0	0	0	0	0	0	0	0	0	0	0	0	0	0	0	0	0	0	0	0	0
487	3	2	hamlet	who i	0	0	0	0	0	0	0	0	0	0	0	0	0	0	0	0	0	0	0	0	0	0	0	1	0	0	0	0	0	0	0	0	0	0	0	0
488	3	2	ophelia	ay my lord	0	0	0	0	0	0	0	0	0	0	0	0	0	0	1	0	0	0	0	0	0	0	0	0	0	0	0	0	0	0	0	0	0	0	0	0
489	3	2	hamlet	o god your only jig maker what should a man do but be merry for look you how cheerfully my mother look and my father die within s two hour	0	0	0	0	0	0	0	0	0	0	0	0	0	0	0	0	0	0	0	0	0	0	0	1	0	0	0	0	0	0	0	0	0	0	0	0
490	3	2	ophelia	nay tis twice two month my lord	0	0	0	0	0	0	0	0	0	0	0	0	0	0	1	0	0	0	0	0	0	0	0	0	0	0	0	0	0	0	0	0	0	0	0	0
491	3	2	hamlet	so long nay then let the devil wear black for i ll have a suit of sable o heavens die two month ago and not forget yet then there hope a great man s memory may outlive his life half a year but by r lady he must build church then or else shall he suffer not think on with the hobby horse whose epitaph be for o for o the hobby horse be forget trumpet sound the dumb show enter enter a king and a queen very lovingly the queen embrace he and he she she kneel and make show of protestation unto he he take she up and decline his head upon her neck lay he down upon a bank of flower she see he asleep leave he anon come in a fellow take off his crown kiss it pour poison in the king s ear and exit the queen return find the king dead and make passionate action the poisoner with some three or four mute come in again seem to lament with she the dead body be carry away the poisoner woo the queen with gift she seem loth and unwilling awhile but in the end accept his love	0	0	0	0	0	0	0	0	0	0	0	0	0	0	0	0	0	0	0	0	0	0	0	1	0	0	0	0	0	0	0	0	0	0	0	0
492	3	2	ophelia	what mean this my lord	0	0	0	0	0	0	0	0	0	0	0	0	0	0	1	0	0	0	0	0	0	0	0	0	0	0	0	0	0	0	0	0	0	0	0	0
493	3	2	hamlet	marry this be miche mallicho it mean mischief	0	0	0	0	0	0	0	0	0	0	0	0	0	0	0	0	0	0	0	0	0	0	0	1	0	0	0	0	0	0	0	0	0	0	0	0
494	3	2	ophelia	belike this show import the argument of the play enter prologue	0	0	0	0	0	0	0	0	0	0	0	0	0	0	1	0	0	0	0	0	0	0	0	0	0	0	0	0	0	0	0	0	0	0	0	0
495	3	2	hamlet	we shall know by this fellow the player can not keep counsel they ll tell all	0	0	0	0	0	0	0	0	0	0	0	0	0	0	0	0	0	0	0	0	0	0	0	1	0	0	0	0	0	0	0	0	0	0	0	0
496	3	2	ophelia	will they tell we what this show mean	0	0	0	0	0	0	0	0	0	0	0	0	0	0	1	0	0	0	0	0	0	0	0	0	0	0	0	0	0	0	0	0	0	0	0	0
497	3	2	hamlet	ay or any show that you ll show he be not you ashamed to show he ll not shame to tell you what it mean	0	0	0	0	0	0	0	0	0	0	0	0	0	0	0	0	0	0	0	0	0	0	0	1	0	0	0	0	0	0	0	0	0	0	0	0
498	3	2	ophelia	you be naught you be naught i ll mark the play	0	0	0	0	0	0	0	0	0	0	0	0	0	0	1	0	0	0	0	0	0	0	0	0	0	0	0	0	0	0	0	0	0	0	0	0
499	3	2	prologue	for we and for our tragedy here stoop to your clemency we beg your hearing patiently	0	0	0	0	0	0	0	0	0	0	0	0	0	0	0	0	0	0	0	0	0	0	0	1	0	0	0	0	0	0	0	0	0	0	0	0
500	3	2	hamlet	be this a prologue or the posy of a ring	0	0	0	0	0	0	0	0	0	0	0	0	0	0	0	0	0	0	0	0	0	0	0	0	0	0	0	0	0	1	0	0	0	0	0	0
501	3	2	ophelia	tis brief my lord	0	0	0	0	0	0	0	0	0	0	0	0	0	0	1	0	0	0	0	0	0	0	0	0	0	0	0	0	0	0	0	0	0	0	0	0
502	3	2	hamlet	as woman s love enter a king and a queen	0	0	0	0	0	0	0	0	0	0	0	0	0	0	0	0	0	0	0	0	0	0	0	1	0	0	0	0	0	0	0	0	0	0	0	0
503	3	2	player king	full thirty time hath phoebus cart go round neptune s salt wash and tellus orbed ground and thirty dozen moon with borrow d sheen about the world have time twelve thirty be since love our heart and hymen do our hand unite commutual in most sacred band	0	0	0	0	0	0	0	0	0	0	0	0	0	0	1	0	0	0	0	0	0	0	0	0	0	0	0	0	0	0	0	0	0	0	0	0
504	3	2	player queen	so many journey may the sun and moon make we again count o er ere love be do but woe be i you be so sick of late so far from cheer and from your former state that i distrust you yet though i distrust discomfort you my lord it nothing must for woman s fear and love hold quantity in neither aught or in extremity now what my love be proof hath make you know and as my love be siz d my fear be so where love be great the little doubt be fear where little fear grow great great love grow there	0	0	0	0	0	0	0	0	0	0	0	0	0	0	0	0	0	0	0	0	0	0	0	0	0	1	0	0	0	0	0	0	0	0	0	0
505	3	2	player king	faith i must leave thee love and shortly too my operant power their function leave to do and thou shalt live in this fair world behind honour d belov d and haply one as kind for husband shalt thou	0	0	0	0	0	0	0	0	0	0	0	0	0	0	0	0	0	0	0	0	0	0	0	0	0	0	1	0	0	0	0	0	0	0	0	0
506	3	2	player queen	o confound the rest such love must need be treason in my breast in second husband let i be accurst none we d the second but who kill d the first	0	0	0	0	0	0	0	0	0	0	0	0	0	0	0	0	0	0	0	0	0	0	0	0	0	1	0	0	0	0	0	0	0	0	0	0
507	3	2	hamlet	wormwood wormwood	0	0	0	0	0	0	0	0	0	0	0	0	0	0	0	0	0	0	0	0	0	0	0	0	0	0	1	0	0	0	0	0	0	0	0	0
508	3	2	player queen	the instance that second marriage move be base respect of thrift but none of love a second time i kill my husband dead when second husband kiss i in bed	0	0	0	0	0	0	0	0	0	0	0	0	0	0	1	0	0	0	0	0	0	0	0	0	0	0	0	0	0	0	0	0	0	0	0	0
509	3	2	player king	i do believe you think what now you speak but what we do determine oft we break purpose be but the slave to memory of violent birth but poor validity which now like fruit unripe stick on the tree but fall unshaken when they mellow be most necessary tis that we forget to pay ourselves what to ourselves be debt what to ourselves in passion we propose the passion end doth the purpose lose the violence of either grief or joy their own enacture with themselves destroy where joy most revel grief doth most lament grief joy joy grieve on slender accident this world be not for aye nor tis not strange that even our love should with our fortune change for tis a question leave we yet to prove whether love lead fortune or else fortune love the great man down you mark his favourite fly the poor advanc d make friend of enemy and hitherto doth love on fortune tend for who not need shall never lack a friend and who in want a hollow friend doth try directly season he his enemy but orderly to end where i begin our will and fate do so contrary run that our device still be overthrow our thought be ours their end none of our own so think thou wilt no second husband we d but die thy thought when thy first lord be dead	0	0	0	0	0	0	0	0	0	0	0	0	0	0	0	0	0	0	0	0	0	0	0	0	0	0	1	0	0	0	0	0	0	0	0	0
510	3	2	player queen	nor earth to i give food nor heaven light sport and repose lock from i day and night to desperation turn my trust and hope an anchor s cheer in prison be my scope each opposite that blank the face of joy meet what i would have well and it destroy both here and hence pursue i last strife if once a widow ever i be wife	0	0	0	0	0	0	0	0	0	0	0	0	0	0	0	0	0	0	0	0	0	0	0	0	0	1	0	0	0	0	0	0	0	0	0	0
511	3	2	hamlet	if she should break it now	0	0	0	0	0	0	0	0	0	0	0	0	0	0	0	0	0	0	0	0	0	0	0	0	0	0	1	0	0	0	0	0	0	0	0	0
512	3	2	player king	tis deeply swear sweet leave i here awhile my spirit grow dull and fain i would beguile the tedious day with sleep	0	0	0	0	0	0	0	0	0	0	0	0	0	0	1	0	0	0	0	0	0	0	0	0	0	0	0	0	0	0	0	0	0	0	0	0
513	3	2	player queen	sleep rock thy brain and never come mischance between we twain	0	0	0	0	0	0	0	0	0	0	0	0	0	0	0	0	0	0	0	0	0	0	0	0	0	1	0	0	0	0	0	0	0	0	0	0
514	3	2	hamlet	madam how like you this play	0	0	0	0	0	0	0	0	0	0	0	0	0	0	0	0	0	0	0	0	0	0	0	0	0	0	1	0	0	0	0	0	0	0	0	0
515	3	2	queen	the lady protest too much methink	0	0	0	0	0	0	0	0	0	0	0	0	0	0	1	0	0	0	0	0	0	0	0	0	0	0	0	0	0	0	0	0	0	0	0	0
516	3	2	hamlet	o but she ll keep her word	0	0	0	0	0	0	0	0	0	0	0	0	0	0	0	0	0	0	0	0	0	0	0	0	0	0	0	0	0	0	1	0	0	0	0	0
517	3	2	king	have you hear the argument be there no offence in t	0	0	0	0	0	0	0	0	0	0	0	0	0	0	1	0	0	0	0	0	0	0	0	0	0	0	0	0	0	0	0	0	0	0	0	0
518	3	2	hamlet	no no they do but jest poison in jest no offence i th world	0	0	0	0	0	0	0	0	0	0	0	0	0	0	0	0	1	0	0	0	0	0	0	0	0	0	0	0	0	0	0	0	0	0	0	0
519	3	2	king	what do you call the play	0	0	0	0	0	0	0	0	0	0	0	0	0	0	1	0	0	0	0	0	0	0	0	0	0	0	0	0	0	0	0	0	0	0	0	0
520	3	2	hamlet	the mousetrap marry how tropically this play be the image of a murder do in vienna gonzago be the duke s name his wife baptista you shall see anon tis a knavish piece of work but what o that your majesty and we that have free soul it touch we not let the gall d jade wince our wither be unwrung enter lucianus this be one lucianus nephew to the king	0	0	0	0	0	0	0	0	0	0	0	0	0	0	0	0	1	0	0	0	0	0	0	0	0	0	0	0	0	0	0	0	0	0	0	0
521	3	2	ophelia	you be a good chorus my lord	0	0	0	0	0	0	0	0	0	0	0	0	0	0	1	0	0	0	0	0	0	0	0	0	0	0	0	0	0	0	0	0	0	0	0	0
522	3	2	hamlet	i could interpret between you and your love if i could see the puppet dally	0	0	0	0	0	0	0	0	0	0	0	0	0	0	0	0	0	0	0	0	0	0	0	1	0	0	0	0	0	0	0	0	0	0	0	0
523	3	2	ophelia	you be keen my lord you be keen	0	0	0	0	0	0	0	0	0	0	0	0	0	0	1	0	0	0	0	0	0	0	0	0	0	0	0	0	0	0	0	0	0	0	0	0
524	3	2	hamlet	it would cost you a groaning to take off my edge	0	0	0	0	0	0	0	0	0	0	0	0	0	0	0	0	0	0	0	0	0	0	0	1	0	0	0	0	0	0	0	0	0	0	0	0
525	3	2	ophelia	still well and bad	0	0	0	0	0	0	0	0	0	0	0	0	0	0	1	0	0	0	0	0	0	0	0	0	0	0	0	0	0	0	0	0	0	0	0	0
526	3	2	hamlet	so you mistake your husbands begin murderer pox leave thy damnable face and begin come the croak raven doth bellow for revenge	0	0	0	0	0	0	0	0	0	0	0	0	0	0	0	0	0	0	0	0	0	0	0	1	0	0	0	0	0	0	0	0	0	0	0	0
527	3	2	lucianus	thought black hand apt drug fit and time agree confederate season else no creature seeing thou mixture rank of midnight weed collect with hecate s ban thrice blast thrice infect thy natural magic and dire property on wholesome life usurp immediately	0	0	0	0	0	0	0	0	0	0	0	0	0	0	1	0	0	0	0	0	0	0	0	0	0	0	0	0	0	0	0	0	0	0	0	0
528	3	2	hamlet	he poison he i th garden for s estate his name s gonzago the story be extant and write in very choice italian you shall see anon how the murderer get the love of gonzago s wife	0	0	0	0	0	0	0	0	0	0	0	0	0	0	0	0	0	0	0	0	1	0	0	0	0	0	0	0	0	0	0	0	0	0	0	0
529	3	2	ophelia	the king rise	0	0	0	0	0	0	0	0	0	0	0	0	0	0	1	0	0	0	0	0	0	0	0	0	0	0	0	0	0	0	0	0	0	0	0	0
530	3	2	hamlet	what fright with false fire	0	0	0	0	0	0	0	0	0	0	0	0	0	0	0	0	0	0	0	0	0	0	0	1	0	0	0	0	0	0	0	0	0	0	0	0
531	3	2	queen	how fare my lord	0	0	0	0	0	0	0	0	0	0	0	0	0	0	1	0	0	0	0	0	0	0	0	0	0	0	0	0	0	0	0	0	0	0	0	0
532	3	2	polonius	give o er the play	0	0	0	0	0	0	0	0	0	0	0	0	0	0	0	0	0	0	0	0	0	0	0	0	0	0	0	0	0	0	1	0	0	0	0	0
533	3	2	king	give i some light away all light light light	0	0	0	0	0	0	0	0	0	0	0	0	0	0	0	0	0	0	0	0	0	0	0	0	0	0	0	1	0	0	0	0	0	0	0	0
534	3	2	hamlet	why let the strucken deer go weep the hart ungalle play for some must watch while some must sleep so run the world away would not this sir and a forest of feather if the rest of my fortune turn turk with i with two provincial rose on my razed shoe get i a fellowship in a cry of player sir	0	0	0	0	0	0	0	0	0	0	0	0	0	0	0	0	1	0	0	0	0	0	0	0	0	0	0	0	0	0	0	0	0	0	0	0
535	3	2	horatio	half a share	0	0	0	0	0	0	0	0	0	0	0	0	0	0	1	0	0	0	0	0	0	0	0	0	0	0	0	0	0	0	0	0	0	0	0	0
536	3	2	hamlet	a whole one i for thou dost know o damon dear this realm dismantle be of jove himself and now reign here a very very pajock	0	0	0	0	0	0	0	0	0	0	0	0	0	0	0	1	0	0	0	0	0	0	0	0	0	0	0	0	0	0	0	0	0	0	0	0
537	3	2	horatio	you might have rhyme	0	0	0	0	0	0	0	0	0	0	0	0	0	0	1	0	0	0	0	0	0	0	0	0	0	0	0	0	0	0	0	0	0	0	0	0
538	3	2	hamlet	o good horatio i ll take the ghost s word for a thousand pound didst perceive	0	0	0	0	0	0	0	0	0	0	0	0	0	0	0	1	0	0	0	0	0	0	0	0	0	0	0	0	0	0	0	0	0	0	0	0
539	3	2	horatio	very well my lord	0	0	0	0	0	0	0	0	0	0	0	0	0	0	1	0	0	0	0	0	0	0	0	0	0	0	0	0	0	0	0	0	0	0	0	0
540	3	2	hamlet	upon the talk of the poisoning	0	0	0	0	0	0	0	0	0	0	0	0	0	0	0	1	0	0	0	0	0	0	0	0	0	0	0	0	0	0	0	0	0	0	0	0
541	3	2	horatio	i do very well note he	0	0	0	0	0	0	0	0	0	0	0	0	0	0	1	0	0	0	0	0	0	0	0	0	0	0	0	0	0	0	0	0	0	0	0	0
542	3	2	hamlet	ah ha come some music come the recorder for if the king like not the comedy why then belike he like it not perdie come some music enter rosencrantz and guildenstern	0	0	0	0	0	0	0	0	0	0	0	0	0	0	0	1	0	0	0	0	0	0	0	0	0	0	0	0	0	0	0	0	0	0	0	0
543	3	2	guildenstern	good my lord vouchsafe i a word with you	0	0	0	0	0	0	0	0	0	0	0	0	0	0	1	0	0	0	0	0	0	0	0	0	0	0	0	0	0	0	0	0	0	0	0	0
544	3	2	hamlet	sir a whole history	0	0	0	0	0	0	0	0	0	0	0	0	0	1	0	0	0	0	0	0	0	0	0	0	0	0	0	0	0	0	0	0	0	0	0	0
545	3	2	guildenstern	the king sir	0	0	0	0	0	0	0	0	0	0	0	0	0	0	1	0	0	0	0	0	0	0	0	0	0	0	0	0	0	0	0	0	0	0	0	0
546	3	2	hamlet	ay sir what of he	0	0	0	0	0	0	0	0	0	0	0	0	0	1	0	0	0	0	0	0	0	0	0	0	0	0	0	0	0	0	0	0	0	0	0	0
547	3	2	guildenstern	be in his retirement marvellous distempered	0	0	0	0	0	0	0	0	0	0	0	0	0	0	1	0	0	0	0	0	0	0	0	0	0	0	0	0	0	0	0	0	0	0	0	0
548	3	2	hamlet	with drink sir	0	0	0	0	0	0	0	0	0	0	0	0	0	1	0	0	0	0	0	0	0	0	0	0	0	0	0	0	0	0	0	0	0	0	0	0
549	3	2	guildenstern	no my lord rather with choler	0	0	0	0	0	0	0	0	0	0	0	0	0	0	1	0	0	0	0	0	0	0	0	0	0	0	0	0	0	0	0	0	0	0	0	0
550	3	2	hamlet	your wisdom should show itself more rich to signify this to the doctor for i to put he to his purgation would perhaps plunge he into far more choler	0	0	0	0	0	0	0	0	0	0	0	0	0	1	0	0	0	0	0	0	0	0	0	0	0	0	0	0	0	0	0	0	0	0	0	0
551	3	2	guildenstern	good my lord put your discourse into some frame and start not so wildly from my affair	0	0	0	0	0	0	0	0	0	0	0	0	0	0	1	0	0	0	0	0	0	0	0	0	0	0	0	0	0	0	0	0	0	0	0	0
552	3	2	hamlet	i be tame sir pronounce	0	0	0	0	0	0	0	0	0	0	0	0	0	1	0	0	0	0	0	0	0	0	0	0	0	0	0	0	0	0	0	0	0	0	0	0
553	3	2	guildenstern	the queen your mother in most great affliction of spirit hath send i to you	0	0	0	0	0	0	0	0	0	0	0	0	0	0	1	0	0	0	0	0	0	0	0	0	0	0	0	0	0	0	0	0	0	0	0	0
554	3	2	hamlet	you be welcome	0	0	0	0	0	0	0	0	0	0	0	0	0	1	0	0	0	0	0	0	0	0	0	0	0	0	0	0	0	0	0	0	0	0	0	0
555	3	2	guildenstern	nay good my lord this courtesy be not of the right breed if it shall please you to make i a wholesome answer i will do your mother s commandment if not your pardon and my return shall be the end of my business	0	0	0	0	0	0	0	0	0	0	0	0	0	0	1	0	0	0	0	0	0	0	0	0	0	0	0	0	0	0	0	0	0	0	0	0
556	3	2	hamlet	sir i can not	0	0	0	0	0	0	0	0	0	0	0	0	0	1	0	0	0	0	0	0	0	0	0	0	0	0	0	0	0	0	0	0	0	0	0	0
557	3	2	guildenstern	what my lord	0	0	0	0	0	0	0	0	0	0	0	0	0	0	1	0	0	0	0	0	0	0	0	0	0	0	0	0	0	0	0	0	0	0	0	0
558	3	2	hamlet	make you a wholesome answer my wit diseased but sir such answer as i can make you shall command or rather as you say my mother therefore no more but to the matter my mother you say	0	0	0	0	0	0	0	0	0	0	0	0	0	1	0	0	0	0	0	0	0	0	0	0	0	0	0	0	0	0	0	0	0	0	0	0
559	3	2	rosencrantz	then thus she say your behaviour hath strike she into amazement and admiration	0	0	0	0	0	0	0	0	0	0	0	0	0	0	1	0	0	0	0	0	0	0	0	0	0	0	0	0	0	0	0	0	0	0	0	0
560	3	2	hamlet	o wonderful son that can so stonish a mother but be there no sequel at the heel of this mother s admiration	0	0	0	0	0	0	0	0	0	0	0	0	0	0	0	0	0	0	0	0	0	0	0	0	0	0	0	0	0	0	0	0	1	0	0	0
561	3	2	rosencrantz	she desire to speak with you in her closet ere you go to bed	0	0	0	0	0	0	0	0	0	0	0	0	0	0	1	0	0	0	0	0	0	0	0	0	0	0	0	0	0	0	0	0	0	0	0	0
562	3	2	hamlet	we shall obey be she ten time our mother have you any further trade with we	0	0	0	0	0	0	0	0	0	0	0	0	0	0	0	0	0	0	0	0	0	0	0	0	0	0	0	0	0	0	0	0	1	0	0	0
563	3	2	rosencrantz	my lord you once do love i	0	0	0	0	0	0	0	0	0	0	0	0	0	0	1	0	0	0	0	0	0	0	0	0	0	0	0	0	0	0	0	0	0	0	0	0
564	3	2	hamlet	and so i do still by these picker and stealer	0	0	0	0	0	0	0	0	0	0	0	0	0	0	0	0	0	0	0	0	0	0	0	0	0	0	0	0	0	0	0	0	1	0	0	0
565	3	2	rosencrantz	good my lord what be your cause of distemper you do surely bar the door upon your own liberty if you deny your grief to your friend	0	0	0	0	0	0	0	0	0	0	0	0	0	0	1	0	0	0	0	0	0	0	0	0	0	0	0	0	0	0	0	0	0	0	0	0
566	3	2	hamlet	sir i lack advancement	0	0	0	0	0	0	0	0	0	0	0	0	0	0	0	0	0	0	0	0	0	0	0	0	0	0	0	0	0	0	0	0	1	0	0	0
567	3	2	rosencrantz	how can that be when you have the voice of the king himself for your succession in denmark	0	0	0	0	0	0	0	0	0	0	0	0	0	0	1	0	0	0	0	0	0	0	0	0	0	0	0	0	0	0	0	0	0	0	0	0
568	3	2	hamlet	ay sir but while the grass grow the proverb be something musty re enter the players with recorder o the recorder let i see one to withdraw with you why do you go about to recover the wind of i as if you would drive i into a toil	0	0	0	0	0	0	0	0	0	0	0	0	0	0	0	0	0	0	0	0	0	0	0	0	0	0	0	0	0	0	0	0	1	0	0	0
