	act	scene	char_from	text	all	barnardo	both	captain	danes	first ambassador	first clown	first player	first sailor	fortinbras	francisco	gentleman	ghost	guildenstern	hamlet	horatio	king	laertes	lord	lords	lucianus	marcellus	messenger	ophelia	osric	player king	player queen	polonius	priest	prologue	queen	reynaldo	rosencrantz	second clown	servant	voltemand
791	4	6	hamlet	come i will give you way for these your letter and do t the speedy that you may direct i to he from whom you bring they	0	0	0	0	0	0	0	0	0	0	0	0	0	0	0	1	0	0	0	0	0	0	0	0	0	0	0	0	0	0	0	0	0	0	0	0
792	4	7	king	now must your conscience my acquittance seal and you must put i in your heart for friend sith you have hear and with a know ear that he which hath your noble father slay pursu d my life	0	0	0	0	0	0	0	0	0	0	0	0	0	0	0	0	0	1	0	0	0	0	0	0	0	0	0	0	0	0	0	0	0	0	0	0
793	4	7	laertes	it well appear but tell i why you proceed not against these feat so crimeful and so capital in nature as by your safety wisdom all thing else you mainly be stirr d up	0	0	0	0	0	0	0	0	0	0	0	0	0	0	0	0	1	0	0	0	0	0	0	0	0	0	0	0	0	0	0	0	0	0	0	0
794	4	7	king	o for two special reason which may to you perhaps seem much unsinew d but yet to i they be strong the queen his mother live almost by his look and for myself my virtue or my plague be it either which she so conjunctive to my life and soul that as the star move not but in his sphere i could not but by she the other motive why to a public count i might not go be the great love the general gender bear he who dip all his fault in their affection would like the spring that turneth wood to stone convert his gyve to grace so that my arrow too slightly timber d for so loud a wind would have revert to my bow again and not where i have aim d they	0	0	0	0	0	0	0	0	0	0	0	0	0	0	0	0	0	1	0	0	0	0	0	0	0	0	0	0	0	0	0	0	0	0	0	0
795	4	7	laertes	and so have i a noble father lose a sister drive into desperate term whose worth if praise may go back again stand challenger on mount of all the age for her perfection but my revenge will come	0	0	0	0	0	0	0	0	0	0	0	0	0	0	0	0	1	0	0	0	0	0	0	0	0	0	0	0	0	0	0	0	0	0	0	0
796	4	7	king	break not your sleep for that you must not think that we be make of stuff so flat and dull that we can let our beard be shake with danger and think it pastime you shortly shall hear more i lov d your father and we love ourself and that i hope will teach you to imagine enter a messenger how now what news	0	0	0	0	0	0	0	0	0	0	0	0	0	0	0	0	0	1	0	0	0	0	0	0	0	0	0	0	0	0	0	0	0	0	0	0
797	4	7	messenger	letter my lord from hamlet this to your majesty this to the queen	0	0	0	0	0	0	0	0	0	0	0	0	0	0	0	0	1	0	0	0	0	0	0	0	0	0	0	0	0	0	0	0	0	0	0	0
798	4	7	king	from hamlet who bring they	0	0	0	0	0	0	0	0	0	0	0	0	0	0	0	0	0	0	0	0	0	0	1	0	0	0	0	0	0	0	0	0	0	0	0	0
799	4	7	messenger	sailor my lord they say i see they not they be give i by claudio he receiv d they of he that bring they	0	0	0	0	0	0	0	0	0	0	0	0	0	0	0	0	1	0	0	0	0	0	0	0	0	0	0	0	0	0	0	0	0	0	0	0
800	4	7	king	laerte you shall hear they leave we high and mighty you shall know i be set naked on your kingdom tomorrow shall i beg leave to see your kingly eye when i shall first ask your pardon thereunto recount the occasion of my sudden and more strange return	0	0	0	0	0	0	0	0	0	0	0	0	0	0	0	0	0	0	0	0	0	0	1	0	0	0	0	0	0	0	0	0	0	0	0	0
801	4	7	hamlet	what should this mean be all the rest come back or be it some abuse and no such thing	0	0	0	0	0	0	0	0	0	0	0	0	0	0	0	0	1	0	0	0	0	0	0	0	0	0	0	0	0	0	0	0	0	0	0	0
802	4	7	laertes	know you the hand	0	0	0	0	0	0	0	0	0	0	0	0	0	0	1	0	0	0	0	0	0	0	0	0	0	0	0	0	0	0	0	0	0	0	0	0
803	4	7	king	tis hamlet s character naked and in a postscript here he say alone can you advise i	0	0	0	0	0	0	0	0	0	0	0	0	0	0	0	0	0	1	0	0	0	0	0	0	0	0	0	0	0	0	0	0	0	0	0	0
804	4	7	laertes	i be lose in it my lord but let he come it warm the very sickness in my heart that i shall live and tell he to his tooth thus diest thou	0	0	0	0	0	0	0	0	0	0	0	0	0	0	0	0	1	0	0	0	0	0	0	0	0	0	0	0	0	0	0	0	0	0	0	0
805	4	7	king	if it be so laertes as how should it be so how otherwise will you be rul d by i	0	0	0	0	0	0	0	0	0	0	0	0	0	0	0	0	0	1	0	0	0	0	0	0	0	0	0	0	0	0	0	0	0	0	0	0
806	4	7	laertes	ay my lord so you will not o errule i to a peace	0	0	0	0	0	0	0	0	0	0	0	0	0	0	0	0	1	0	0	0	0	0	0	0	0	0	0	0	0	0	0	0	0	0	0	0
807	4	7	king	to thine own peace if he be now return d as check at his voyage and that he mean no more to undertake it i will work he to exploit now ripe in my device under the which he shall not choose but fall and for his death no wind shall breathe but even his mother shall uncharge the practice and call it accident	0	0	0	0	0	0	0	0	0	0	0	0	0	0	0	0	0	1	0	0	0	0	0	0	0	0	0	0	0	0	0	0	0	0	0	0
808	4	7	laertes	my lord i will be rul d the rather if you could devise it so that i might be the organ	0	0	0	0	0	0	0	0	0	0	0	0	0	0	0	0	1	0	0	0	0	0	0	0	0	0	0	0	0	0	0	0	0	0	0	0
809	4	7	king	it fall right you have be talk d of since your travel much and that in hamlet s hearing for a quality wherein they say you shine your sum of part do not together pluck such envy from he as do that one and that in my regard of the unworthi siege	0	0	0	0	0	0	0	0	0	0	0	0	0	0	0	0	0	1	0	0	0	0	0	0	0	0	0	0	0	0	0	0	0	0	0	0
810	4	7	laertes	what part be that my lord	0	0	0	0	0	0	0	0	0	0	0	0	0	0	0	0	1	0	0	0	0	0	0	0	0	0	0	0	0	0	0	0	0	0	0	0
811	4	7	king	a very riband in the cap of youth yet needful too for youth no less become the light and careless livery that it wear than settle age his sable and his weed import health and graveness two month since here be a gentleman of normandy i ve see myself and serv d against the french and they can well on horseback but this gallant have witchcraft in t he grow unto his seat and to such wondrous do bring his horse as have he be incorps d and demi natur d with the brave beast so far he topp d my thought that i in forgery of shape and trick come short of what he do	0	0	0	0	0	0	0	0	0	0	0	0	0	0	0	0	0	1	0	0	0	0	0	0	0	0	0	0	0	0	0	0	0	0	0	0
812	4	7	laertes	a norman was t	0	0	0	0	0	0	0	0	0	0	0	0	0	0	0	0	1	0	0	0	0	0	0	0	0	0	0	0	0	0	0	0	0	0	0	0
813	4	7	king	a norman	0	0	0	0	0	0	0	0	0	0	0	0	0	0	0	0	0	1	0	0	0	0	0	0	0	0	0	0	0	0	0	0	0	0	0	0
814	4	7	laertes	upon my life lamond	0	0	0	0	0	0	0	0	0	0	0	0	0	0	0	0	1	0	0	0	0	0	0	0	0	0	0	0	0	0	0	0	0	0	0	0
815	4	7	king	the very same	0	0	0	0	0	0	0	0	0	0	0	0	0	0	0	0	0	1	0	0	0	0	0	0	0	0	0	0	0	0	0	0	0	0	0	0
816	4	7	laertes	i know he well he be the brooch indeed and gem of all the nation	0	0	0	0	0	0	0	0	0	0	0	0	0	0	0	0	1	0	0	0	0	0	0	0	0	0	0	0	0	0	0	0	0	0	0	0
817	4	7	king	he make confession of you and give you such a masterly report for art and exercise in your defence and for your rapier most especially that he cry out twould be a sight indeed if one could match you the scrimer of their nation he swear have neither motion guard nor eye if you oppos d they sir this report of his did hamlet so envenom with his envy that he could nothing do but wish and beg your sudden come o er to play with he now out of this	0	0	0	0	0	0	0	0	0	0	0	0	0	0	0	0	0	1	0	0	0	0	0	0	0	0	0	0	0	0	0	0	0	0	0	0
818	4	7	laertes	what out of this my lord	0	0	0	0	0	0	0	0	0	0	0	0	0	0	0	0	1	0	0	0	0	0	0	0	0	0	0	0	0	0	0	0	0	0	0	0
819	4	7	king	laerte be your father dear to you or be you like the painting of a sorrow a face without a heart	0	0	0	0	0	0	0	0	0	0	0	0	0	0	0	0	0	1	0	0	0	0	0	0	0	0	0	0	0	0	0	0	0	0	0	0
820	4	7	laertes	why ask you this	0	0	0	0	0	0	0	0	0	0	0	0	0	0	0	0	1	0	0	0	0	0	0	0	0	0	0	0	0	0	0	0	0	0	0	0
821	4	7	king	not that i think you do not love your father but that i know love be begin by time and that i see in passage of proof time qualify the spark and fire of it there live within the very flame of love a kind of wick or snuff that will abate it and nothing be at a like goodness still for goodness grow to a pleurisy die in his own too much that we would do we should do when we would for this would change and hath abatement and delay as many as there be tongue be hand be accident and then this should be like a spendthrift sigh that hurt by ease but to the quick o th ulcer hamlet come back what would you undertake to show yourself your father s son in deed more than in word	0	0	0	0	0	0	0	0	0	0	0	0	0	0	0	0	0	1	0	0	0	0	0	0	0	0	0	0	0	0	0	0	0	0	0	0
822	4	7	laertes	to cut his throat i th church	0	0	0	0	0	0	0	0	0	0	0	0	0	0	0	0	1	0	0	0	0	0	0	0	0	0	0	0	0	0	0	0	0	0	0	0
823	4	7	king	no place indeed should murder sanctuarize revenge should have no bound but good laertes will you do this keep close within your chamber hamlet return d shall know you be come home we ll put on those shall praise your excellence and set a double varnish on the fame the frenchman give you bring you in fine together and wager on your head he be remiss most generous and free from all contrive will not peruse the foil so that with ease or with a little shuffling you may choose a sword unbate and in a pass of practice requite he for your father	0	0	0	0	0	0	0	0	0	0	0	0	0	0	0	0	0	1	0	0	0	0	0	0	0	0	0	0	0	0	0	0	0	0	0	0
824	4	7	laertes	i will do t and for that purpose i ll anoint my sword i buy an unction of a mountebank so mortal that but dip a knife in it where it draw blood no cataplasm so rare collect from all simple that have virtue under the moon can save the thing from death this be but scratch d withal i ll touch my point with this contagion that if i gall he slightly it may be death	0	0	0	0	0	0	0	0	0	0	0	0	0	0	0	0	1	0	0	0	0	0	0	0	0	0	0	0	0	0	0	0	0	0	0	0
825	4	7	king	let s far think of this weigh what convenience both of time and mean may fit we to our shape if this should fail and that our drift look through our bad performance twere well not assay d therefore this project should have a back or second that might hold if this do blast in proof soft let i see we ll make a solemn wager on your cunning i ha t when in your motion you be hot and dry as make your bout more violent to that end and that he call for drink i ll have prepar d he a chalice for the nonce whereon but sip if he by chance escape your venom d stick our purpose may hold there enter queen how now sweet queen	0	0	0	0	0	0	0	0	0	0	0	0	0	0	0	0	0	1	0	0	0	0	0	0	0	0	0	0	0	0	0	0	0	0	0	0
826	4	7	queen	one woe doth tread upon another s heel so fast they follow your sister s drown d laertes	0	0	0	0	0	0	0	0	0	0	0	0	0	0	0	0	1	0	0	0	0	0	0	0	0	0	0	0	0	0	0	0	0	0	0	0
827	4	7	laertes	drown d o where	0	0	0	0	0	0	0	0	0	0	0	0	0	0	0	0	0	0	0	0	0	0	0	0	0	0	0	0	0	0	1	0	0	0	0	0
828	4	7	queen	there be a willow grow aslant a brook that show his hoary leave in the glassy stream there with fantastic garland do she make of crow flower nettle daisy and long purple that liberal shepherd give a gross name but our cold maid do dead man s finger call they there on the pendant bough her coronet weed clamb re to hang an envious sliver break when down her weedy trophy and herself fall in the weeping brook her clothe spread wide and mermaid like awhile they bear she up which time she chaunte snatch of old tune as one incapable of her own distress or like a creature native and indue unto that element but long it could not be till that her garment heavy with their drink pull d the poor wretch from her melodious lay to muddy death	0	0	0	0	0	0	0	0	0	0	0	0	0	0	0	0	0	1	0	0	0	0	0	0	0	0	0	0	0	0	0	0	0	0	0	0
829	4	7	laertes	alas then she be drown d	0	0	0	0	0	0	0	0	0	0	0	0	0	0	0	0	0	0	0	0	0	0	0	0	0	0	0	0	0	0	1	0	0	0	0	0
830	4	7	queen	drown d drown d	0	0	0	0	0	0	0	0	0	0	0	0	0	0	0	0	0	1	0	0	0	0	0	0	0	0	0	0	0	0	0	0	0	0	0	0
831	4	7	laertes	too much of water hast thou poor ophelia and therefore i forbid my tear but yet it be our trick nature her custom hold let shame say what it will when these be go the woman will be out adieu my lord i have a speech of fire that fain would blaze but that this folly dout it	0	0	0	0	0	0	0	0	0	0	0	0	0	0	0	0	0	0	0	0	0	0	0	0	0	0	0	0	0	0	1	0	0	0	0	0
832	4	7	king	let s follow gertrude how much i have to do to calm his rage now fear i this will give it start again therefore let s follow	0	0	0	0	0	0	0	0	0	0	0	0	0	0	0	0	0	1	0	0	0	0	0	0	0	0	0	0	0	0	0	0	0	0	0	0
833	5	1	first clown	be she to be bury in christian burial when she wilfully seek her own salvation	0	0	0	0	0	0	0	0	0	0	0	0	0	0	0	0	0	0	0	0	0	0	0	0	0	0	0	0	0	0	0	0	0	1	0	0
834	5	1	second clown	i tell thee she be and therefore make her grave straight the crowner hath sit on she and find it christian burial	0	0	0	0	0	0	1	0	0	0	0	0	0	0	0	0	0	0	0	0	0	0	0	0	0	0	0	0	0	0	0	0	0	0	0	0
835	5	1	first clown	how can that be unless she drown herself in her own defence	0	0	0	0	0	0	0	0	0	0	0	0	0	0	0	0	0	0	0	0	0	0	0	0	0	0	0	0	0	0	0	0	0	1	0	0
836	5	1	second clown	why tis find so	0	0	0	0	0	0	1	0	0	0	0	0	0	0	0	0	0	0	0	0	0	0	0	0	0	0	0	0	0	0	0	0	0	0	0	0
837	5	1	first clown	it must be se offendendo it can not be else for here lie the point if i drown myself wittingly it argue an act and an act hath three branch it be to act to do and to perform argal she drown herself wittingly	0	0	0	0	0	0	0	0	0	0	0	0	0	0	0	0	0	0	0	0	0	0	0	0	0	0	0	0	0	0	0	0	0	1	0	0
838	5	1	second clown	nay but hear you goodman delver	0	0	0	0	0	0	1	0	0	0	0	0	0	0	0	0	0	0	0	0	0	0	0	0	0	0	0	0	0	0	0	0	0	0	0	0
839	5	1	first clown	give i leave here lie the water good here stand the man good if the man go to this water and drown himself it be will he nill he he goes mark you that but if the water come to he and drown he he drown not himself argal he that be not guilty of his own death shorten not his own life	0	0	0	0	0	0	0	0	0	0	0	0	0	0	0	0	0	0	0	0	0	0	0	0	0	0	0	0	0	0	0	0	0	1	0	0
840	5	1	second clown	but be this law	0	0	0	0	0	0	1	0	0	0	0	0	0	0	0	0	0	0	0	0	0	0	0	0	0	0	0	0	0	0	0	0	0	0	0	0
841	5	1	first clown	ay marry is t crowner s quest law	0	0	0	0	0	0	0	0	0	0	0	0	0	0	0	0	0	0	0	0	0	0	0	0	0	0	0	0	0	0	0	0	0	1	0	0
842	5	1	second clown	will you ha the truth on t if this have not be a gentlewoman she should have be bury out o christian burial	0	0	0	0	0	0	1	0	0	0	0	0	0	0	0	0	0	0	0	0	0	0	0	0	0	0	0	0	0	0	0	0	0	0	0	0
843	5	1	first clown	why there thou say st and the more pity that great folk should have countenance in this world to drown or hang themselves more than their even christian come my spade there be no ancient gentleman but gardener ditcher and grave maker they hold up adam s profession	0	0	0	0	0	0	0	0	0	0	0	0	0	0	0	0	0	0	0	0	0	0	0	0	0	0	0	0	0	0	0	0	0	1	0	0
844	5	1	second clown	be he a gentleman	0	0	0	0	0	0	1	0	0	0	0	0	0	0	0	0	0	0	0	0	0	0	0	0	0	0	0	0	0	0	0	0	0	0	0	0
845	5	1	first clown	he be the first that ever bear arm	0	0	0	0	0	0	0	0	0	0	0	0	0	0	0	0	0	0	0	0	0	0	0	0	0	0	0	0	0	0	0	0	0	1	0	0
846	5	1	second clown	why he have none	0	0	0	0	0	0	1	0	0	0	0	0	0	0	0	0	0	0	0	0	0	0	0	0	0	0	0	0	0	0	0	0	0	0	0	0
847	5	1	first clown	what art a heathen how dost thou understand the scripture the scripture say adam digg d could he dig without arm i ll put another question to thee if thou answerest i not to the purpose confess thyself	0	0	0	0	0	0	0	0	0	0	0	0	0	0	0	0	0	0	0	0	0	0	0	0	0	0	0	0	0	0	0	0	0	1	0	0
848	5	1	second clown	go to	0	0	0	0	0	0	1	0	0	0	0	0	0	0	0	0	0	0	0	0	0	0	0	0	0	0	0	0	0	0	0	0	0	0	0	0
849	5	1	first clown	what be he that build strong than either the mason the shipwright or the carpenter	0	0	0	0	0	0	0	0	0	0	0	0	0	0	0	0	0	0	0	0	0	0	0	0	0	0	0	0	0	0	0	0	0	1	0	0
850	5	1	second clown	the gallow maker for that frame outlive a thousand tenant	0	0	0	0	0	0	1	0	0	0	0	0	0	0	0	0	0	0	0	0	0	0	0	0	0	0	0	0	0	0	0	0	0	0	0	0
851	5	1	first clown	i like thy wit well in good faith the gallow do well but how do it well it do well to those that do ill now thou dost ill to say the gallow be build strong than the church argal the gallow may do well to thee to t again come	0	0	0	0	0	0	0	0	0	0	0	0	0	0	0	0	0	0	0	0	0	0	0	0	0	0	0	0	0	0	0	0	0	1	0	0
852	5	1	second clown	who build strong than a mason a shipwright or a carpenter	0	0	0	0	0	0	1	0	0	0	0	0	0	0	0	0	0	0	0	0	0	0	0	0	0	0	0	0	0	0	0	0	0	0	0	0
853	5	1	first clown	ay tell i that and unyoke	0	0	0	0	0	0	0	0	0	0	0	0	0	0	0	0	0	0	0	0	0	0	0	0	0	0	0	0	0	0	0	0	0	1	0	0
854	5	1	second clown	marry now i can tell	0	0	0	0	0	0	1	0	0	0	0	0	0	0	0	0	0	0	0	0	0	0	0	0	0	0	0	0	0	0	0	0	0	0	0	0
855	5	1	first clown	to t	0	0	0	0	0	0	0	0	0	0	0	0	0	0	0	0	0	0	0	0	0	0	0	0	0	0	0	0	0	0	0	0	0	1	0	0
856	5	1	second clown	mass i can not tell enter hamlet and horatio at a distance	0	0	0	0	0	0	1	0	0	0	0	0	0	0	0	0	0	0	0	0	0	0	0	0	0	0	0	0	0	0	0	0	0	0	0	0
857	5	1	first clown	cudgel thy brain no more about it for your dull ass will not mend his pace with beating and when you be ask this question next say a grave maker the house he make last till doomsday go get thee to yaughan fetch i a stoup of liquor in youth when i do love do love methought it be very sweet to contract o the time for a my behove o methought there be nothing meet	0	0	0	0	0	0	0	0	0	0	0	0	0	0	0	0	0	0	0	0	0	0	0	0	0	0	0	0	0	0	0	0	0	1	0	0
858	5	1	hamlet	have this fellow no feeling of his business that he sing at grave making	0	0	0	0	0	0	1	0	0	0	0	0	0	0	0	0	0	0	0	0	0	0	0	0	0	0	0	0	0	0	0	0	0	0	0	0
859	5	1	horatio	custom hath make it in he a property of easiness	0	0	0	0	0	0	0	0	0	0	0	0	0	0	1	0	0	0	0	0	0	0	0	0	0	0	0	0	0	0	0	0	0	0	0	0
860	5	1	hamlet	tis e en so the hand of little employment hath the dainty sense	0	0	0	0	0	0	0	0	0	0	0	0	0	0	0	1	0	0	0	0	0	0	0	0	0	0	0	0	0	0	0	0	0	0	0	0
861	5	1	first clown	but age with his stealing step hath claw d i in his clutch and hath shipp d i into the land as if i have never be such	0	0	0	0	0	0	0	0	0	0	0	0	0	0	1	0	0	0	0	0	0	0	0	0	0	0	0	0	0	0	0	0	0	0	0	0
862	5	1	hamlet	that skull have a tongue in it and could sing once how the knave jowl it to th ground as if twere cain s jawbone that do the first murder this might be the pate of a politician which this ass now o er office one that would circumvent god might it not	0	0	0	0	0	0	1	0	0	0	0	0	0	0	0	0	0	0	0	0	0	0	0	0	0	0	0	0	0	0	0	0	0	0	0	0
863	5	1	horatio	it might my lord	0	0	0	0	0	0	0	0	0	0	0	0	0	0	1	0	0	0	0	0	0	0	0	0	0	0	0	0	0	0	0	0	0	0	0	0
864	5	1	hamlet	or of a courtier which could say good morrow sweet lord how dost thou good lord this might be my lord such a one that praise my lord such a one s horse when he mean to beg it might it not	0	0	0	0	0	0	0	0	0	0	0	0	0	0	0	1	0	0	0	0	0	0	0	0	0	0	0	0	0	0	0	0	0	0	0	0
865	5	1	horatio	ay my lord	0	0	0	0	0	0	0	0	0	0	0	0	0	0	1	0	0	0	0	0	0	0	0	0	0	0	0	0	0	0	0	0	0	0	0	0
866	5	1	hamlet	why e en so and now my lady worm s chapless and knock about the mazard with a sexton s spade here fine revolution an we have the trick to see t do these bone cost no more the breeding but to play at logget with em mine ache to think on t	0	0	0	0	0	0	0	0	0	0	0	0	0	0	0	1	0	0	0	0	0	0	0	0	0	0	0	0	0	0	0	0	0	0	0	0
867	5	1	first clown	a pickaxe and a spade a spade for and a shroud sheet o a pit of clay for to be make for such a guest be meet	0	0	0	0	0	0	0	0	0	0	0	0	0	0	1	0	0	0	0	0	0	0	0	0	0	0	0	0	0	0	0	0	0	0	0	0
868	5	1	hamlet	there another why may not that be the skull of a lawyer where be his quiddit now his quillet his case his tenure and his trick why do he suffer this rude knave now to knock he about the sconce with a dirty shovel and will not tell he of his action of battery hum this fellow might be in s time a great buyer of land with his statute his recognizance his fine his double voucher his recovery be this the fine of his fine and the recovery of his recovery to have his fine pate full of fine dirt will his voucher vouch he no more of his purchase and double one too than the length and breadth of a pair of indenture the very conveyance of his land will scarcely lie in this box and must the inheritor himself have no more ha	0	0	0	0	0	0	1	0	0	0	0	0	0	0	0	0	0	0	0	0	0	0	0	0	0	0	0	0	0	0	0	0	0	0	0	0
869	5	1	horatio	not a jot more my lord	0	0	0	0	0	0	0	0	0	0	0	0	0	0	1	0	0	0	0	0	0	0	0	0	0	0	0	0	0	0	0	0	0	0	0	0
870	5	1	hamlet	be not parchment make of sheep skin	0	0	0	0	0	0	0	0	0	0	0	0	0	0	0	1	0	0	0	0	0	0	0	0	0	0	0	0	0	0	0	0	0	0	0	0
871	5	1	horatio	ay my lord and of calf skin too	0	0	0	0	0	0	0	0	0	0	0	0	0	0	1	0	0	0	0	0	0	0	0	0	0	0	0	0	0	0	0	0	0	0	0	0
872	5	1	hamlet	they be sheep and calf which seek out assurance in that i will speak to this fellow whose grave this sir	0	0	0	0	0	0	0	0	0	0	0	0	0	0	0	1	0	0	0	0	0	0	0	0	0	0	0	0	0	0	0	0	0	0	0	0
873	5	1	first clown	mine sir o a pit of clay for to be make for such a guest be meet	0	0	0	0	0	0	0	0	0	0	0	0	0	0	1	0	0	0	0	0	0	0	0	0	0	0	0	0	0	0	0	0	0	0	0	0
874	5	1	hamlet	i think it be thine indeed for thou liest in t	0	0	0	0	0	0	1	0	0	0	0	0	0	0	0	0	0	0	0	0	0	0	0	0	0	0	0	0	0	0	0	0	0	0	0	0
875	5	1	first clown	you lie out on t sir and therefore tis not yours for my part i do not lie in t yet it be mine	0	0	0	0	0	0	0	0	0	0	0	0	0	0	1	0	0	0	0	0	0	0	0	0	0	0	0	0	0	0	0	0	0	0	0	0
876	5	1	hamlet	thou dost lie in t to be in t and say it be thine tis for the dead not for the quick therefore thou liest	0	0	0	0	0	0	1	0	0	0	0	0	0	0	0	0	0	0	0	0	0	0	0	0	0	0	0	0	0	0	0	0	0	0	0	0
877	5	1	first clown	tis a quick lie sir t will away again from i to you	0	0	0	0	0	0	0	0	0	0	0	0	0	0	1	0	0	0	0	0	0	0	0	0	0	0	0	0	0	0	0	0	0	0	0	0
878	5	1	hamlet	what man dost thou dig it for	0	0	0	0	0	0	1	0	0	0	0	0	0	0	0	0	0	0	0	0	0	0	0	0	0	0	0	0	0	0	0	0	0	0	0	0
879	5	1	first clown	for no man sir	0	0	0	0	0	0	0	0	0	0	0	0	0	0	1	0	0	0	0	0	0	0	0	0	0	0	0	0	0	0	0	0	0	0	0	0
880	5	1	hamlet	what woman then	0	0	0	0	0	0	1	0	0	0	0	0	0	0	0	0	0	0	0	0	0	0	0	0	0	0	0	0	0	0	0	0	0	0	0	0
881	5	1	first clown	for none neither	0	0	0	0	0	0	0	0	0	0	0	0	0	0	1	0	0	0	0	0	0	0	0	0	0	0	0	0	0	0	0	0	0	0	0	0
882	5	1	hamlet	who be to be bury in t	0	0	0	0	0	0	1	0	0	0	0	0	0	0	0	0	0	0	0	0	0	0	0	0	0	0	0	0	0	0	0	0	0	0	0	0
883	5	1	first clown	one that be a woman sir but rest her soul she dead	0	0	0	0	0	0	0	0	0	0	0	0	0	0	1	0	0	0	0	0	0	0	0	0	0	0	0	0	0	0	0	0	0	0	0	0
884	5	1	hamlet	how absolute the knave be we must speak by the card or equivocation will undo we by the lord horatio these three year i have take note of it the age be grow so pick that the toe of the peasant come so near the heel of the courtier he gall his kibe how long hast thou be a grave maker	0	0	0	0	0	0	1	0	0	0	0	0	0	0	0	0	0	0	0	0	0	0	0	0	0	0	0	0	0	0	0	0	0	0	0	0
885	5	1	first clown	of all the day i th year i come to t that day that our last king hamlet o ercame fortinbras	0	0	0	0	0	0	0	0	0	0	0	0	0	0	1	0	0	0	0	0	0	0	0	0	0	0	0	0	0	0	0	0	0	0	0	0
886	5	1	hamlet	how long be that since	0	0	0	0	0	0	1	0	0	0	0	0	0	0	0	0	0	0	0	0	0	0	0	0	0	0	0	0	0	0	0	0	0	0	0	0
887	5	1	first clown	can not you tell that every fool can tell that it be the very day that young hamlet be born he that be mad and send into england	0	0	0	0	0	0	0	0	0	0	0	0	0	0	1	0	0	0	0	0	0	0	0	0	0	0	0	0	0	0	0	0	0	0	0	0
888	5	1	hamlet	ay marry why be he send into england	0	0	0	0	0	0	1	0	0	0	0	0	0	0	0	0	0	0	0	0	0	0	0	0	0	0	0	0	0	0	0	0	0	0	0	0
889	5	1	first clown	why because he be mad he shall recover his wit there or if he do not it no great matter there	0	0	0	0	0	0	0	0	0	0	0	0	0	0	1	0	0	0	0	0	0	0	0	0	0	0	0	0	0	0	0	0	0	0	0	0
890	5	1	hamlet	why	0	0	0	0	0	0	1	0	0	0	0	0	0	0	0	0	0	0	0	0	0	0	0	0	0	0	0	0	0	0	0	0	0	0	0	0
891	5	1	first clown	twill not be see in he there there the man be as mad as he	0	0	0	0	0	0	0	0	0	0	0	0	0	0	1	0	0	0	0	0	0	0	0	0	0	0	0	0	0	0	0	0	0	0	0	0
892	5	1	hamlet	how come he mad	0	0	0	0	0	0	1	0	0	0	0	0	0	0	0	0	0	0	0	0	0	0	0	0	0	0	0	0	0	0	0	0	0	0	0	0
893	5	1	first clown	very strangely they say	0	0	0	0	0	0	0	0	0	0	0	0	0	0	1	0	0	0	0	0	0	0	0	0	0	0	0	0	0	0	0	0	0	0	0	0
894	5	1	hamlet	how strangely	0	0	0	0	0	0	1	0	0	0	0	0	0	0	0	0	0	0	0	0	0	0	0	0	0	0	0	0	0	0	0	0	0	0	0	0
895	5	1	first clown	faith e en with lose his wit	0	0	0	0	0	0	0	0	0	0	0	0	0	0	1	0	0	0	0	0	0	0	0	0	0	0	0	0	0	0	0	0	0	0	0	0
896	5	1	hamlet	upon what ground	0	0	0	0	0	0	1	0	0	0	0	0	0	0	0	0	0	0	0	0	0	0	0	0	0	0	0	0	0	0	0	0	0	0	0	0
897	5	1	first clown	why here in denmark i have be sexton here man and boy thirty year	0	0	0	0	0	0	0	0	0	0	0	0	0	0	1	0	0	0	0	0	0	0	0	0	0	0	0	0	0	0	0	0	0	0	0	0
898	5	1	hamlet	how long will a man lie i th earth ere he rot	0	0	0	0	0	0	1	0	0	0	0	0	0	0	0	0	0	0	0	0	0	0	0	0	0	0	0	0	0	0	0	0	0	0	0	0
899	5	1	first clown	faith if he be not rotten before he die a we have many pocky corse nowadays that will scarce hold the laying in he will last you some eight year or nine year a tanner will last you nine year	0	0	0	0	0	0	0	0	0	0	0	0	0	0	1	0	0	0	0	0	0	0	0	0	0	0	0	0	0	0	0	0	0	0	0	0
900	5	1	hamlet	why he more than another	0	0	0	0	0	0	1	0	0	0	0	0	0	0	0	0	0	0	0	0	0	0	0	0	0	0	0	0	0	0	0	0	0	0	0	0
901	5	1	first clown	why sir his hide be so tann d with his trade that he will keep out water a great while and your water be a sore decayer of your whoreson dead body here a skull now this skull hath lain in the earth three and twenty year	0	0	0	0	0	0	0	0	0	0	0	0	0	0	1	0	0	0	0	0	0	0	0	0	0	0	0	0	0	0	0	0	0	0	0	0
902	5	1	hamlet	whose be it	0	0	0	0	0	0	1	0	0	0	0	0	0	0	0	0	0	0	0	0	0	0	0	0	0	0	0	0	0	0	0	0	0	0	0	0
903	5	1	first clown	a whoreson mad fellow it be whose do you think it be	0	0	0	0	0	0	0	0	0	0	0	0	0	0	1	0	0	0	0	0	0	0	0	0	0	0	0	0	0	0	0	0	0	0	0	0
904	5	1	hamlet	nay i know not	0	0	0	0	0	0	1	0	0	0	0	0	0	0	0	0	0	0	0	0	0	0	0	0	0	0	0	0	0	0	0	0	0	0	0	0
905	5	1	first clown	a pestilence on he for a mad rogue a pour d a flagon of rhenish on my head once this same skull sir be yorick s skull the king s jester	0	0	0	0	0	0	0	0	0	0	0	0	0	0	1	0	0	0	0	0	0	0	0	0	0	0	0	0	0	0	0	0	0	0	0	0
906	5	1	hamlet	this	0	0	0	0	0	0	1	0	0	0	0	0	0	0	0	0	0	0	0	0	0	0	0	0	0	0	0	0	0	0	0	0	0	0	0	0
907	5	1	first clown	e en that	0	0	0	0	0	0	0	0	0	0	0	0	0	0	1	0	0	0	0	0	0	0	0	0	0	0	0	0	0	0	0	0	0	0	0	0
908	5	1	hamlet	let i see alas poor yorick i know he horatio a fellow of infinite jest of most excellent fancy he hath bear i on his back a thousand time and now how abhor in my imagination it be my gorge rise at it here hang those lip that i have kiss d i know not how oft where be your gibe now your gambol your song your flash of merriment that be will not to set the table on a roar not one now to mock your own grinning quite chop fall now get you to my lady s chamber and tell she let she paint an inch thick to this favour she must come make she laugh at that prythee horatio tell i one thing	0	0	0	0	0	0	1	0	0	0	0	0	0	0	0	0	0	0	0	0	0	0	0	0	0	0	0	0	0	0	0	0	0	0	0	0
